{"schema":"rie.admission_decision.v1","decision_id":"adm_20260308050357346_7790a143604f","decided_at_utc":"2026-03-08T05:03:57.3465683Z","source_id":"s_comm_001","source_hash":"","audience_band":"child_7_10","policy_id":"src.child_7_10.v1","evaluation_id":"eval_20260308050357346_6eec907c9745","action":"QUARANTINE_REVIEW_ONLY","reason_code":"QUARANTINE_REQUIRES_REVIEW","warning_label":"Source requires review before surfacing to learner.","notes":""}
